_id,app_name,user_score,user_date,user_comments,evaluation
662f3b6434754d6a96872824,myrealtrip,1,2024-02-08T00:29:35-07:00,아무리 중계채널이라고 하지만\n여행 상품이나 업체에 대한 신뢰를 맺고 상품을 중계해주실텐데..\n여행 상품 바우처가 업체에서 잘못 제공되었고\n그 부분에 대한 신고 접수를 바로 진행했음에도\n결국 여행 끝날때까지 아무런 조치 없어 재이용도 못하고 환불도 못받나서\n소비자보호원 접수했음에도 결국 환불 못받았네요.\n\n중간 다리인 마이리얼트립을 믿고 결제한만큼 너무 실망스러워서 재이용 안할랍니다..,0
662f3b6434754d6a96872825,myrealtrip,5,2024-02-07T02:47:38-07:00,Ui도좋고 예약도 싑고 조아욭 커뮤니티왜만들엇지싶엇는데 동행구해서 흠.. 뭔일당할사람은 그게운명인거겠쥬 동행구하고 현지상황도 볼수있고 정보도 많이 얻울수있고 카페가입하는거보다 더 좋긴해유 하지만 동행구하는건 조심하셔요~ 요즘세상 자기몸은 자기가지키시길,0
662f3b6434754d6a96872826,myrealtrip,1,2024-02-04T21:50:42-07:00,고객센터 연결되기 너무 힘드네요.. 비용절감하는지 서비스가 갈수록 별로입니다,0
662f3b6434754d6a96872827,myrealtrip,1,2024-01-15T23:43:25-07:00,하..\n전화 연결도 어려워요..,0
662f3b6434754d6a96872828,myrealtrip,2,2024-01-15T19:25:53-07:00,아니 여행계획 잡는데 예약하고 친구한테 공유가 안됨여;; 여행어플에 이런건 첨이네… 공유하는것도 만들어주세요….,0
662f3b6434754d6a96872829,myrealtrip,5,2024-01-15T00:31:51-07:00,비행기 구매했는데 자동으로 세부 투어 티켓 추천해줘서 좋았습니다 덕분에 몰랐던 새벽 도착 후 마사지도 진행하기로 했네요 ~~~ \n\n투어도 이용하시고 남기신 후기들이 많아 보고 선택하기 편했습니다 ^^,0
662f3b6434754d6a9687282a,myrealtrip,5,2024-01-14T04:31:38-07:00,정말 예약 너무편하고 좋게 이용하고있는데\n검색창에 가우디만 검색하면 에러생기다가 튕기네용..! 배우자 핸드폰도 동일해요! 해결부탁드립니다ㅠㅜ,0
662f3b6434754d6a9687282b,myrealtrip,5,2024-01-12T00:10:58-07:00,덕분에 좋은 작가님 만나게되어 파리의 추억을 남길수 있어서 너무 좋았습니다!!,0
662f3b6434754d6a9687282c,myrealtrip,5,2024-01-11T09:17:41-07:00,세부적이고 전문적인 프로그램이 많아 선택의 폭이 넓어서 좋습니다. 몇년전 프라도 미술관 프라이빗 투어가 만족스러워서 이번에 바티칸 투어에 참여했는데 역시 좋았습니다~^^,0
662f3b6434754d6a9687282d,myrealtrip,5,2024-01-10T19:33:36-07:00,너무 좋은 경험이었요.,0
662f3b6434754d6a9687282e,myrealtrip,1,2024-01-09T17:08:54-07:00,기억하고싶지않은 여행이여서 지난여행기록 삭제하려고 보니까 삭제기능도없고 삭제요청하니까 계정탈퇴하라함 대신 쿠폰/보너스 다없고 현재 예약된 일정도 보장못해주고 사용자사정이니까 사용자가 알아서하셈~식의 대응. 포인트야 사라져도되는데 사용자가 필요한시점에 당연히 지원되어야하는 기능이 없다는 개발자의\n한계,0
662f3b6434754d6a9687282f,myrealtrip,1,2024-01-04T14:04:52-07:00,취소환불 당연 안됨 수수료는 뭐 말해 뭐해\n직원이랑 이야기 하는데 상당히 싸가지 없음\n다신 이용안할예정임\n비슷한 어플 많으니 여기저기 잘 알아보세요 개비추,0
662f3b6434754d6a96872830,myrealtrip,5,2024-01-03T02:33:29-07:00,"2024년 새해 첫 날을 흰그림자투어 검은그림자 가이드님과 함께 시작했어요.\n저희는 중2 아들, 중3 딸과 함께 한 4인 가족이었는데요, 저희 외에 6명의 일행이 함께 이동했어요. 날씨가 너무 좋아서 시야가 탁 트였고 그 덕분에 정말 평생에 한 번 볼까말까한 절경을 많이 봤답니다. 지금껏 봤던 눈은 제대로 된 눈이 아니었던 것 같아요. 허리까지 푹푹 들어가는 파우더리한 눈에서 아이처럼 맘껏 뒹굴어 보기도 하고 멋진 인생샷도 많이 찍었어요. 한창 사춘기인 남매도 이 날만큼은 정말 맘껏 웃고 눈밭을 뒹굴며 행복해했구요. 검은 그림자님 덕분에 1월 1일이었음에도 불구하고 맛있는 점심 식사 할 수 있었고 사람들 와글와글한 시간 피해서 여유있게 즐길 수 있었어요. 오가는 길에 차속에서 여우도 보고 사슴도 보고 정말 최고의 여행을 마치고 돌아왔습니다. 이제 당분간은 아이들이랑 완전체 여행을 하긴 힘들 거라 생각해요. 친구들이랑 가려고 하겠죠.^^ 검은 그림자님의 연륜있는 가이드와 드라이빙 덕분에 너무나 즐겁고 행복한 가족 여행하고 왔습니다. 함께 한 6분의 일행분들도 너무 좋으셨어요. 흰그림자 투어 너무 만족이예요.",0
662f3b6434754d6a96872831,myrealtrip,3,2024-01-02T14:01:06-07:00,"결제시스템 너무 불편하내요\n앱으로 카드사간편결제하고 싶은데,\n카드 번호 풀로 입력하고, 정보 세서 사용할까 겁나내요",0
662f3b6434754d6a96872832,myrealtrip,5,2024-01-01T18:39:33-07:00,갑작스런 부고로 해외에 계신 아버지가 들어오실 항공권 변경이 급히 필요했는데 빠른 답변 주심에 감사했습니다. 변경 사유 말씀 드린 후 따로 콜백이 와서 직계가족 부고의 경우 변경 수수료 면제 받을 수 있다고 안내해주셨는데 사려깊게 신경 써주신 점 굉장히 감사드립니다. \n당시에 정신이 없어서 감사인사를 제대로 못 드렸던 것 같은데 서비스 운영팀 김*윤 매니저님 도움 주셔서 정말 감사합니다. \n덕분에 아버지 제때 도착하셔서 장례 마무리 잘 할 수 있었습니다.,0
662f3b6434754d6a96872833,myrealtrip,5,2023-12-31T05:22:40-07:00,여행 준비하기 편합니다. \n자주 이용할거 같아요~~,0
662f3b6434754d6a96872834,myrealtrip,5,2023-12-28T09:14:02-07:00,반드시 필요한 여행어플 감사합니다,0
662f3b6434754d6a96872835,myrealtrip,5,2023-12-28T07:21:23-07:00,웬만하면 리뷰 잘 안쓰는데 속도도 빠르고 인터페이스도 깔끔하고 특히 내 여행 목록에서 쉽고 빠르게 예약한 내용들 볼 수 있어서 여행 어플들중에 가장 좋은듯,0
662f3b6434754d6a96872836,myrealtrip,5,2023-12-27T15:42:12-07:00,예약도 편하고 어쩔수 없이 예약취소 한것도 금방 처리되고 좋네요 처음 이용해봤는데 앞으로 자주 이용할듯합니다,0
662f3b6434754d6a96872837,myrealtrip,4,2023-12-26T06:09:46-07:00,"좋은 프로그램으로 여행 잘 다녔습니다. 다만 확정 된 이후에는 결제수담 변경 불가여서(취소하면 차감 50%나 100%입니다), 이후에 변경하지 못하는 어려움이 있어요.",0
662f3b6434754d6a96872838,myrealtrip,1,2023-12-22T21:26:42-07:00,모르고 잘못예약한건 제 잘못이지만 바로 알아차리고 바로 취소 부탁드렸지만 절대 안됨\n살면서 실수 하면 절대 안됨을 뼈저리게 가르쳐줌\n현지 호탤과 통화까지 했는데도 안됨 ㅜㅜ\n다신 안함 !!!!,0
662f3b6434754d6a96872839,myrealtrip,5,2023-12-21T15:43:23-07:00,"여행에 있어 정말 많은 도움 받았어요\n라피트고속, 일일투어, 주유패스 정말 유익하고 알차게 사용했어요",0
662f3b6434754d6a9687283a,myrealtrip,4,2023-12-06T01:37:07-07:00,"해외여행시에 항상 잘 사용하고 있습니다.\n다만, 이번에 여행하고 난 뒤에 느낀것은 상품 등록하는 방식에 있어서 \n같은 상품을 재등록하는 것에 대해 사람이 판단 후에 재등록 가능여부를 정해줬으면 합니다.\n\n이번 여행에서 등록한 투어 2개 모두 문제가 있었습니다.\n하나는 투어 상품등록한 분이 임의로 당일에 프라이빗에서 그룹으로 말도없이 상품을 바꿨고, 하나는 가이드분이 미숙하였습니다.\n\n그래서 솔직히 상품의 리뷰를 작성했더니, \n리뷰를 등록한 해당 상품을 내려버리고 다시 다른 상품으로 올리더군요…. \n이러면 상품이 좋은지 좋지 않은지 다음 소비자가 정확히 판단하기 어렵고, \n소비자를 속는것 아닌가 하는 생각이 들더라구요.\n\n투어에 같은 코스의 같은 상품이라면 재등록하지 못하는 등의\n같은 상품 재등록 방식에 대한 틀이 생겼으면 좋겠네요.",0
662f3b6434754d6a9687283b,myrealtrip,1,2023-11-30T23:20:49-07:00,미술관 티켓 끊어놓았는데 유효기간 만료되고 다음날 후기 쓰라고 알림 와서 유효기간 지난거 알게 되었어요. \n마감일자 전에 리마인드 하는 알림은 정책적으로 안되어있으니 환불 안된다하는데 리뷰 쓰라는 알림은 보내서 리뷰는 받고 싶으신가봐요. 정책만 정해져 있음 그거 들이 밀면서 안돼~ 하면 그만인가요? 만기일자 전에 알림 한번 보내주는게 뭐 그리 어려우신지..,0
662f3b6434754d6a9687283c,myrealtrip,1,2023-11-28T19:50:20-07:00,후 한숨이 나옵니다\n30분만에 2만원 날리고\n보니까 구매 후 바로 취소해도 \n수수료가 환불이 아예 안되더라구요\n다른 분들도 그래서 10만원 날린 사람도 봤는데\n후기 꼭 참고하시길,0
662f3b6434754d6a9687283d,myrealtrip,1,2023-11-27T16:05:29-07:00,취소나 변경해야하면 수수료로 다 뜯어가서 돌려받을 수 없어요 왠만하면 쓰지마세요,0
662f3b6434754d6a9687283e,myrealtrip,5,2023-11-26T11:19:10-07:00,독일 방문 처음이었는데 친절하고 스마트하신 가이드분 덕분께서 독일의 역사와 다양한 프랑크푸르트의 이야기들을 들려주셨어요. 가이드분께서 추천해주신 카페에서의 커피향과 짭짭한 소시지에 곁들인  독일 맥주의 풍미가 프랑크푸르트의 행복한 추억으로 기억될것같네요,0
662f3b6434754d6a9687283f,myrealtrip,1,2023-11-25T04:05:26-07:00,배가불러서 책임감이 없는듯\n\n얘네 잘못으로 상품이용을 못했는데\n환불을 안해줘요 그냥 해주기싫대요\n\n다시는 이용안하려구요\n서비스 좋은 어플 쓰세요 여러분,0
662f3b6434754d6a96872840,myrealtrip,5,2023-11-24T01:04:49-07:00,위치 정보가 정확하고 아무 문제없이 숙박할 수 있었습니다,0
662f3b6434754d6a96872841,myrealtrip,5,2023-11-16T21:43:54-07:00,국내 숙소 선택에서 가성비와 깨끗함이 우선적으로 검색되어 안내해 주어서 굳,0
662f3b6434754d6a96872842,myrealtrip,1,2023-11-13T06:38:59-07:00,투어는 한국인 투어 가이드가 바로바로 대응을 해주지만 다른 예매 티켓 등등은 문의를 할 수 있는 창구가 없음 마리트 문의 챗봇은 아무 의미가 없어요\n그러니 되도록 항공권 등 공홈 구매를 추천합니다,0
662f3b6434754d6a96872843,myrealtrip,1,2023-11-13T02:53:26-07:00,예약도 안되는 항공권 가지고 장난쳐서 하루 숙박비 날리고 시간 날림 항공결제금액도 전부 환불 못받고 수수료도 못받음,0
662f3b6434754d6a96872844,myrealtrip,1,2023-11-07T09:58:50-07:00,검색 기능이 고장난건지 계속 숙박 화면만 표시되고 다른 항목 보고 싶은건데 사용할 수가 없어요,0
662f3b6534754d6a96872845,myrealtrip,5,2023-11-02T01:35:53-07:00,"첫 느낌.. ‘소담’ \n시골스러움과 세련됨이 잘 조화롭게 어우러져있어요. \n작은 소품까지 하나 하나 세심하다는 느낌을 받게 하는 곳이었어요. \n이제 청소년이된 아들과 딸이랑 도시 생활에서 받은 스트레스가 극에 달해 마찰도 잦았고 넘 바쁜 시간들에 지쳐서 떠난 여행이었는데 한원 가옥에서의 시간들이 생각을 비울 수 있게 해준 것 같아요. \n\n한원가옥 자체가 정말 아름다운 뷰가 됩니다. 이른아침, 해질녘 그리고 밤… 정말 좋았습니다. \nLP플레이어는 생각도 못한 선물이었습니다. 클래식 음반도 넘 좋았고 노라존슨의 목소리는 집의 색감들과 너무나 잘 어울렸어요. \n\n가장 좋은 것은 샤워실, 자쿠지가 있는데 독립공간에 마련되어 있어서 집안이 습하지 않고 쾌적했어요. 분리된 공간이 절대 불편하지 않아요. 오히려 좋다는 느낌을 받을 수 있을 겁니다. \n\n다시 일상에서 스트레스를 받으면 이 곳을 떠올리게 될 것 같아요. 그리고 언젠가 다시 오겠죠~? ^^ \n\n우리 가족 모두 별 5점 만점입니다!",0
662f3b6534754d6a96872846,myrealtrip,5,2023-10-28T10:15:39-07:00,비슷한 문제 생겼을 때 다른 곳에서 자기들은 잘 모르겠고 항공사 쪽에 직접 문의해보시라 했다던 글 본 적 있어서 문의할 때 긴장했는데 빠르게 답변해주셔서 너무 좋았어요,0
662f3b6534754d6a96872847,myrealtrip,1,2023-10-28T01:55:40-07:00,체크인에대한 안내는 하나도 안하고 현장에서만 가능하다고해서 취소수수료만 50만원 넘게 날렸네요. 항공권 예매는 여기서 하지 마세요.,0
662f3b6534754d6a96872848,myrealtrip,1,2023-10-23T22:33:43-07:00,인증정보가 만료됐다는 화면만 뜨고 앱 실행이 되지 않습니다. 예약은 마친 상태에서 확인도 불가능하고 재인증하는 방법도 없네요…,0
662f3b6534754d6a96872849,myrealtrip,5,2023-10-17T21:40:48-07:00,가성비 가심비 좋은 상품이 많아요.,0
662f3b6534754d6a9687284a,myrealtrip,5,2023-10-16T08:40:16-07:00,"지인의 소개로 두부가이드님 투어를 신청하였는데 봉봉가이드님이 배정되어 진행되었습니다. 약간 서운했는데 그건 완전 저의 기우더라구요~ 완전 대만족입니다^^\n\n첫만남부터 활기찬 목소리로 끝까지 친절하셔서 여행의 행복이 더 배가 되었구요. 함께 투어하시는 분들의 편의를 도와 빠르게 일을 진행하시더라구요~ \n입장표를 사실때도, 음식주문을 하실때도, 다음프로그램이 진행되기전엔 미리 차에서 자세히 안내해주시고 카톡으로 정보 다 공유해주시고~~ \n시간도 마니 단축될뿐 아니라 한분의 실수조차 없이 투어가  빠른 시간내에 잘 마무리 되었습니다.\n봉봉가이드님~ 오늘 하루 넘 고생 많으셨구요~ \n감사드립니다\n\n제가 주는 평점은요~~ 100점 만점에 100점 입니다^^👍👍👍",0
662f3b6534754d6a9687284b,myrealtrip,1,2023-10-15T19:50:25-07:00,진짜 일처리 개느리고 상담원 연결도 개어려움;;\n여행일정변경 하나 처리해주는데 일주일 넘게 걸리는게 말이되나요? 5일안으로 처리 가능하다 적어놨으면 똑바로 일처리를 해주던가 늦어지면 늦어진다 연락을 주던가;;; 상담원 연결은 드릅게 안되고 ㅋㅋㅋㅋㅋㅋ 다시는 이 어플 안써요^^,0
662f3b6534754d6a9687284c,myrealtrip,5,2023-10-14T08:43:53-07:00,남부 투어 꼭 신청하세요. 아침 일찍 움직여야하는 수고로움이 있지만 투자할만큼 충분한 가치가 있아요. 특히 신혼여행중인 커플은 무조건 신청하세요~~,0
662f3b6534754d6a9687284d,myrealtrip,5,2023-10-11T11:50:15-07:00,사용하기 너무 편하구 좋네요:-),0
662f3b6534754d6a9687284e,myrealtrip,1,2023-10-11T00:29:50-07:00,해외에서 리뷰 쓰려고 하는데 LTE 연결이 됐다 안됐다 불안정해서 메모장에 쓰고 붙여넣으려니까 붙여넣기도 안되고 복사도 안되게 막아놨네요?? 리뷰가 가장 중요한 콘텐츠 중에 하나인데 왜 이렇게 불편하게 만들어놓으셨을까요??? 하여튼 불편해서 리뷰 안 쓰고 싶은데 친절한 여행 가이드한테 미안해서라도 억지로 씁니다;;,0
662f3b6534754d6a9687284f,myrealtrip,1,2023-10-01T17:37:24-07:00,"안녕하세요. \n이틀전에 시드니에서 고래 투어 예약을 했습니다.\n예약 당일 1시간 전까지도 확정대기 상태인데요, 통판중개업자로서 판매자의 스테이터스 하나하나 트래킹하여 확정을 강제하거나 유도하기는 어렵다는 점 인지하고 있습니다만 이런 투어 상품의 경우 여행 일정에도 영향을 미치는 부분인 만큼, 플랫폼 차원에서 확정대기 상태가 계속됨을 알리는 카카오톡 알림톡 또는 푸시 알림을 발송해주거나, 대체할만한 (그리고, 현재 예약 확정대기 상태인 투어의 일자에 가능한) 상품을 추천해주는 형태로 시스템적인 보완이 충분이 가능하지 않을까 싶습니다.\n\n이 부분 유선 상으로도 피드백을 드렸지만, 해당 피드백이 제대로 수렴되었다는 느낌읗 받지는 못해 앱 리뷰 형태로 남깁니다.",0
662f3b6534754d6a96872850,myrealtrip,5,2023-09-30T01:57:34-07:00,고쳐주세요…,0
662f3b6534754d6a96872851,myrealtrip,5,2023-09-29T22:15:14-07:00,포르,0
662f3b6534754d6a96872852,myrealtrip,1,2023-09-27T01:13:19-07:00,열라느려터짐 속터짐,0
662f3b6534754d6a96872853,myrealtrip,1,2023-09-22T19:49:52-07:00,마케팅 수신 동의 알림 모두 동의 안했는데 앱으로 광고 알림은 왜 오나요 ㅡㅡ 설치해두고 상품 괜찮으거 있으면 다음 여행때 참고하려고 했는데 동의하지도 않은 광고 알림을 보내는거면 좀 부담수러운데요,0
662f3b6534754d6a96872854,myrealtrip,1,2023-09-19T11:53:02-07:00,여기서 항공권 구매했습니다 25일 남은 지금 여행 취소되어서 항공권 취소하려고 보는데 이중으로 나가더라구요? 전 여태 네이버에서 전부 예약했어서 취소하면 보통 발권수수료랑 취소수수료 정도해서 2만원 미만으로 나갔어요 근데 이중으로 부과 되어서 아 그건가보다 하고 자세히 봤더니 마이리얼트립 취소료 3만원(인당) ㅋㅋㅋ 네 거기까진 오케이 근데 항공 취소 수수료가 얼만지 아세요? 20-10일 전은 9만원 이랍니다 ㅋㅋㅋ\n25일이나 남고 그동안 당연히 비행기표는 팔릴텐데 그람 인당 12만원 수수료 둘이하면 24만인데요? 소비자를 호구등신으로 아십니까? 전 이제 이 앱 안 쓰고 불매하겠습니다 다들 저처럼 당하지 마세요들 블로그 보니까 당한사람이 한두명이 아닙니다,0
662f3b6534754d6a96872855,myrealtrip,1,2023-09-18T03:11:02-07:00,"상담원이 없네요? \n여행사에 상담원 필수아닌가요..\n진심 이번에 변경이나 취소하려고했는데 상담원연결도안되고 변경및 취소는 평일에만 접수받는데 그냥 문의만 남기는수준이에요. 날짜에 따라 수수료 달리받으면서 이렇게 대책없이 변경, 취소도 안되는건 여행상품만 팔아두고 너무 무책임하신거아닌가요. 개선 좀 해주세요. 답이라도 빨리오면 몰라 1~3일 걸린다네요.",0
662f3b6534754d6a96872856,myrealtrip,5,2023-09-10T20:51:39-07:00,❤️,0
662f3b6534754d6a96872857,myrealtrip,5,2023-09-10T20:20:56-07:00,베트남 푸라마리조트 퇴실후 새벽 비행기 기다리는\n\n시간에 예정에 없던 호텔을 긴급히 알아봐야 했어요\n\n잠깐 쉬어갈 수 있는 가성비 있는 호텔을 빨리 \n\n알수 있어서 좋았습니다,0
662f3b6534754d6a96872858,myrealtrip,1,2023-09-09T00:02:51-07:00,여행자보험 가입도 같이했는데 자기들이 계약한곳이 아니라는등 뻔히 앱에 정보도 다 있는데 책임회피만 합니다. 정보도 안넘겨서 생긴 자사 실수도 처리안해줘요 돈 날리고 싶으신분께 추천드립니다.,0
662f3b6534754d6a96872859,myrealtrip,5,2023-09-06T01:47:28-07:00,자유여행의 두려움에 도움을 많이 받았어요!,0
662f3b6534754d6a9687285a,myrealtrip,1,2023-09-06T00:04:17-07:00,사용자 인증에 문제가 생겼다고 떠요..\n로그인이 안돼요.\n어플 지우고 깔고 재시도 해봐도 소용없어요,0
662f3b6534754d6a9687285b,myrealtrip,1,2023-08-29T04:02:22-07:00,결제하기 눌렀는데 계속해서 금액을 확인하라는 메세지만 뜨고 진행이 안돼요 pc로 해보려고해도 무한로딩에ㅠ 답답해요 빠른 해결 부탁드립니다,0
662f3b6534754d6a9687285c,myrealtrip,1,2023-08-25T03:31:04-07:00,계정 삭제하고 다신 이용 안합니다,0
662f3b6534754d6a9687285d,myrealtrip,1,2023-08-24T12:22:27-07:00,"앱을 종료한것도 아닌데 계속 자동으로 로그아웃되서 로그인을 하라고 그러고, 마케팅수신동의 메세지도 페이지 2-3번 바꿀때마다 뜨고… 사용하는데 너무 불편하네요;;;",0
662f3b6534754d6a9687285e,myrealtrip,5,2023-08-20T19:30:08-07:00,많은어플중 가성비좋은 숙소 젤 많은거같아요\n몇군데 돌려가며 보는데 마이리얼트립을 젤많이 이용하게되네요.결과는 언제나 만족입니다!!,0
662f3b6534754d6a9687285f,myrealtrip,5,2023-08-16T21:22:25-07:00,"미리미리 사전보고 ㅋㅌ으로 메세지보내주셔서 안내대로 편안하게 준비했습니다. 오리발은 선택이라 저희는 준비안했구요 ~ 스노쿨링마스크는 개인적으로 구매했서 가지고 갔습니다. 전문가이드분들께서 친절하게 하나하나 잘 잡아주시구요, 한명씩 가이드분이 직접 함께해주시니 수영못하는 저역시 물속에서도 너무 편안하게 바닷속을 구경하고 왔습니다, 돌고래쇼부터 바다거북이를 코앞에서 직접보게되니 너무 신기하도라고여,, 물고기가 코앞에서 몰려드는데 신기롭더라고여,, 고프로사진촬영이 신의 한수였습니다~^^ 바다속에서 자유롭게 움직이시며 입으로 뿜러주시는 롤링거품이 사진촬영을 더욱 빛나게 해주었네요~~^^ 한팀으로 짝이되어주신 두분 가이드분들께 너무 감사드립니다~ 덕분에 예쁜 추억 예쁜사진 남기게 되었네요\n바다속에서 멀미해서 고생한 우리남친 처방까지 아주 친절하게 잘 해주셔서 너무도 즐거운 여행이였습니다 , 고프로 바닷속사진은 이메일로 받게되면 추억으로 사진첩만들까합니다~ 미리 보여주셨는데 너무 예쁘더라구요\n다음 여행때도 가이드해주신분들과 함께하고 싶네요😍😍😍\n여행지중에 나온 점심식사도 나름 좋았습니다~",0
662f3b6534754d6a96872860,myrealtrip,1,2023-08-13T17:29:02-07:00,고객센터는 기계로 대체해서 아무것도 안해줌,0
662f3b6534754d6a96872861,myrealtrip,1,2023-08-10T19:23:02-07:00,진짜 구림,1
662f3b6534754d6a96872862,myrealtrip,5,2023-08-10T02:46:49-07:00,해외여행시 엄청 도움 많이 됩니다.\n현지투어를 통해 더 즐거운 여행 만들 수 있어요!,0
662f3b6534754d6a96872863,myrealtrip,1,2023-08-08T17:45:17-07:00,"항공권 예약 취소할 일이 생겼는데\n항공사 위약금이 아니라, 플랫폼에 취소수수료로 지불하는게 가는편 오는편 각각 3만원이네요..\n조금 당황스러웠습니다. 항공권 위약금보다 높을거라고는 상상도 못했네요…",0
662f3b6534754d6a96872864,myrealtrip,1,2023-08-08T16:13:07-07:00,항공권 변경도 취소도 상담사 업무 시간에만 가능하고 진짜 불편하네요;; 다신 여기서 안합니다,0
662f3b6534754d6a96872865,myrealtrip,5,2023-08-08T11:10:50-07:00,가입하고 싶어서 정보를 입력해도 핸드폰 번호 전주인이 페북으로 가입했던 기록이 있어서 제가 새로 가입이 안 되네요.. 이거 어떻게 해야 되나요?,0
662f3b6534754d6a96872866,myrealtrip,5,2023-08-08T02:03:29-07:00,소소한 이야기와 간결하고 재미있는 설명에 즐거운 투어였어요. 가이드님 감사드립니다.,0
662f3b6534754d6a96872867,myrealtrip,5,2023-08-05T22:22:03-07:00,예약하고 바로 이메일오고 카톡으로도 확인이 오며 여행 가까이 오면 리마인드 시켜주는것이 좋았습니다. 실수 없이 잘 진행되는것이 아주 신뢰감 있습니다,0
662f3b6534754d6a96872868,myrealtrip,5,2023-08-02T20:54:06-07:00,여행에 필요한\n1. 투어 및 압장권 선택에서 신속하고 정확한 예약시스템 좋아요\n2. 창이공항 새벽도착 시 9명의 인원이 호텔 이동 시 교통이 걱정이었는데 마이리얼트립 픽업서비스 이용하니 매우 편리 함,0
662f3b6534754d6a96872869,myrealtrip,5,2023-08-02T15:37:20-07:00,지금 어플 들어가면 오류나는데 왜이러는건가요;;,0
662f3b6534754d6a9687286a,myrealtrip,4,2023-07-30T06:59:10-07:00,사용이 편리해요,0
662f3b6534754d6a9687286b,myrealtrip,3,2023-07-29T13:54:29-07:00,후기 남기는데 에러가 계속나서 답답하네요 어려번 작성하고 넘 구찮았어요,0
662f3b6534754d6a9687286c,myrealtrip,5,2023-07-22T00:54:09-07:00,너무 좋은 이벤트 너무 감사드려요~,0
662f3b6534754d6a9687286d,myrealtrip,5,2023-07-21T20:03:03-07:00,여행 중 너무 편안하고 싼 패키지 상품이 많아서 좋습니다,0
662f3b6534754d6a9687286e,myrealtrip,5,2023-07-19T01:34:23-07:00,액티비티 여행은 여기 어플에서 하는게 비교가 편하고 메뉴가 많아서 골라서 여행의 경험을 할 수 가 있어서 좋아요,0
662f3b6534754d6a9687286f,myrealtrip,4,2023-07-17T08:21:12-07:00,숙소 검색할 때 애견동반 옵션이 있었으면 좋겠어요!!🐶🐶🐶,0
662f3b6534754d6a96872870,myrealtrip,5,2023-07-14T15:44:21-07:00,덕분에 예약 잘 하고 잘 다녀왔습니다,0
662f3b6534754d6a96872871,myrealtrip,1,2023-07-09T21:50:44-07:00,다시는 안씀,0
662f3b6534754d6a96872872,myrealtrip,1,2023-07-08T22:56:37-07:00,ㅜㅜ,0
662f3b6534754d6a96872873,myrealtrip,5,2023-07-08T05:08:11-07:00,여행숙소 검색하기 짱 편해요~~\n감사해요^^,0
