_id,app_name,user_score,user_date,user_comments,evaluation
662f3b6c34754d6a968729e6,myrealtrip,2,2019-11-29T15:51:28-07:00,"부서끼리 내용 전달/공유가 되지 않나봅니다.\n항공권 담당자와 통화하였고 통화내용이 녹음 되었을테니 청취하시기 바랍니다.\n\n필리핀 법무부에서 2015년 7월부터 여권 유효기간 6개월 이상이어야 입국 가능하다는 제도를 폐지 하였습니다. 해당시항 필리핀 관광부(한국싸이트)에 명시되어 있어 링크도 메일로 보내드렸습니다. 이미 공시한지 4년이 지난 제도를 항공권 발급하는 여행사가 전혀 인지를 못하고 있으며, 이에 대한 메뉴얼 없이 “6개월 이상이면 당신이 직접 연락해서 문제없음을 확인하세요.” 를 무한 반복하는게 문제라고 지적 하였습니다.\n\n필리핀 항공권을 마이리얼 트립을 통해서 끊는 사람이 나 하나 뿐이 었던건 아니었을테고. 여권 유효기간 6개월 미만인 사람에 대한 메뉴얼이 있는걸 보면 여권 유효기간에 대한 이슈는 인지 하고 있는 것 같고..... 상황을 종합 해 보았을때, 4년도 더 넘은 공시사항을 여행사에서 인지도 못하고 있고 이에 따른 메뉴얼이 없다? 이게 잘못됐다는 것입니다.\n\n시스템상 내가 항공권을 예매할때 필리핀은 여권 유효기간 6개월과 상관없이 예약 가능해야 하는 것이 가장 이상적이겠습니다. (CS에 연락해야하는 것도, 연락해서 다시 여권번호를 알려주는 것도, 기껏 입력한 내용이 무용지물이 된 것도 사용자 입장에서는 매우 짜증납니다. Cs도 직장인이고 나도 직장인이니 통화는 업무시간에 이루어 지게되며, 업무 시간을 이러한 의미 없는 통화를 하기 위해 소비하는 것이 싫습니다.  이런 시간 할애 하지 않으려고 어플 쓰는 거 아니겠습니까.) \n\n안타깝게도 시스템의 한계로 완전히 이상적인 상황이 될 순 없다. 까지는 이해하겠습니다. 하지만, 내가 cs에게 전화했을 때 그에 대한 인지가 되어있고 그에 맞는 메뉴얼이 제대로 갖추어져 있어, “필리핀은 괜찮은 것 맞고 (시스템상의 한계가 있어 불편을 드려 죄송하지만) 다시 한 번 여권 정보를 불러달라” 라는 답변이 오는 것이 정상이라는 것입니다. 여행사가 몰라서 “확인 해라” 라는 답변이 반복되는 상황이 화가 난다는 것입니다. 내가 분명 첫 통화때 담당자한테 필리핀은 상관없음을  “확인하라” 라고 말했는데, 담당자인지 누군지 전달 받은 누군가는 해당 사항을 확인조차 안했다는 거겠죠. 그러니까 두 번째 전화때 사용자 니가 확인하세요. 라는 연락이 왔겠죠. \n\n‘6개월 이상이 아니라 입국이 안될 염려’에 대해서는, “필리핀의 경우에 해당 제도가 폐지되었지만 만일을 위하여 가급적 6개월 이상의 여권을 사용하시기 바랍니다. 해당내용 사용자에게 전달 해 드렸으므로 문제시 마이리얼 트립에서는 책임지지 않습니다.” 라고 안내와 동시에 차라리 사용자게에 정확히 고지하고 대신에 사용자가 책임을 지게 하든지요. \n\n내가 왜 이런 방향까지 당신들에게 제안 해야 하는지 모르겠습니다? 전화 통화 했으면 전달이라도 되어서, 답변이라도 제대로 달던가. 굳이 또 이런 답변을 달아서 사람이 다시 찾아와서 장문의 글을 쓰게 만듭니까.",0
662f3b6c34754d6a968729e7,myrealtrip,1,2019-11-28T22:45:58-07:00,"10월 호텔 투숙하고, 11월 캐쉬백 프로모션 고지된 날짜에 지급이 안되서 5차\n례 통화와 3차례 채팅서비스로 겨우 환급받았네요.\n\n겉으로 잘 치장했지만 알멩이가 부실한 거 같고, 여행보다는 쇼핑 회사 같은 느낌이 드네요.\n\n마지막으로 태블릿 유저에게도 앱 호환이 제공되면 더 좋을거 같네요.",0
662f3b6c34754d6a968729e8,myrealtrip,1,2019-11-28T00:18:54-07:00,사용하고싶어도 로그인이 안돼요 네이버로 로그인하면 가입된 메일이라고 나와서 로그인 안되고 ㅜㅡ 메일로 로그인할라고 했도니 뭐가또 일치하지가 않대 비번 틀렸나 해서 메일로 비번 재설정까지 해봤는데 그것도 메일이나 비번이 일치하지 않아서 안된대 짜증나서 안쓸래요 부들부들,0
662f3b6c34754d6a968729e9,myrealtrip,1,2019-11-27T19:49:48-07:00,"본인들의 시스템 문제로 항공권이 늦게 최소되어 취소 수수료가 발생 되었음에도 고객에게 취소 수수료를 물었으며 \n\n고객센터에 전화하여 지금까지도 반복하여 설명하였으니 한명이 책임지고 해결해줄 수 있도록 하자 \n\n그럴수 없으며 반복하여 고객센터에 전화하여 똑같은 일을 설명하라고 하였으며 언제해결할수 있을지, 얼마나 걸릴지 시간 약속도 할 수 없으며 본인은 해결해줄 수 없다고 하였음 \n\n고객센터는 고객의 불편의 상황을 해결하고 도와주기 위하여 있는 것이 아닌가요 말투에서 느껴지는 고객 무시외 본인이 해결할수가 없다는 말 언제가 걸릴줄 모르니 모조건 기다리기만 하라는 말에 화가나네요 \n\n말한마디로 천냥빛을 갚는다고 말투와 말이 상냥하였으면 이렇게 후기 남기는 일도 없이 그냥 기다렸을 텐데 별하나 조차도 아깝네요",0
662f3b6c34754d6a968729ea,myrealtrip,4,2019-11-27T15:22:28-07:00,친구들이 분명 제가 보낸 링크로 가입해서 5000원도 받았다는데 저한테 포인트가 안 들어와요...,0
662f3b6c34754d6a968729eb,myrealtrip,5,2019-11-25T06:25:38-07:00,"해외 여행갈때마다 마이리얼트립에서 현지 투어 예약하고 있습니다.\n다양한 시간대와 코스가 많아서 좋고, 투어 시작시간과 장소 및 코스 안내가 자세히 설명되어 있어서 여행 전에 미리 예약하기 용이합니다.",0
662f3b6c34754d6a968729ec,myrealtrip,1,2019-11-24T15:23:21-07:00,"예전에 앱을 설치했었다가 다시 설치하려고 하는데요, 설치 대기중만 뜨고 진행이 안되네요ㅜㅜ 어떻게 해야할까요",0
662f3b6c34754d6a968729ed,myrealtrip,5,2019-11-23T00:53:45-07:00,대만 여행에 있어서\n잘 정리 되어서 쉽게 잘 이용하였어요~,0
662f3b6c34754d6a968729ee,myrealtrip,4,2019-11-21T21:48:52-07:00,물도 너무 맑고 한국말로 잘 되었있어 블편함없고 너무 즐거웠어요,0
662f3b6c34754d6a968729ef,myrealtrip,5,2019-11-20T01:26:50-07:00,이번 여행!  마이리얼트랩으로 미리 예약해서 여유롭게 다녔네요.,0
662f3b6c34754d6a968729f0,myrealtrip,5,2019-11-18T14:55:21-07:00,여행을 가서 시간이 좀 붕 뜬 상황이었어요. \n그 때 마이리얼트립앱에서 상품을 바로 검색하고 구매했죠~\n시간을 알차게 보내고 또한 표사느라 긴 줄을 서지 않았던건 공짜로 얻은 덤같았습니다 ㅎㅎ,0
662f3b6c34754d6a968729f1,myrealtrip,1,2019-11-14T19:19:31-07:00,앱 자체는 고만고만 한거 같음.\n하지만 서비스 자체가 너무 구림\n항공권 신청 및 변경에는 너무나도 불편함\n\n0. 변경 수수료가 거의 항공권 값이 될 때가 있음. 실시간으로 표 확인해서 비교해 보았음.\n1. 항공권 결재시 본인 카드 아니면 관계 서류를 제출 해야 함. 단체 여행에 쥐약임. 법인 결재인 경우 사업등록증 및 재직증명서 까지 제출해야 함.\n2. 항공권 날짜 변경이 실시간으로 안됨. 거의 반나절 걸림.\n3. 항공권 변경에 따른 비용에 결재 카드 변경은 안됨.\n4. 개선 요청에는 꿈쩍도 안함...\n\n사용하기 너무 불편함...,0
662f3b6c34754d6a968729f2,myrealtrip,5,2019-11-14T17:34:14-07:00,두,0
662f3b6c34754d6a968729f3,myrealtrip,5,2019-11-11T16:35:27-07:00,서비스 두개만 더 추가되었으면 좋겠네요\n양가부모님들 모시고 여행가는데\n인원수를 합친 비행기 왕복가격이 나왔으면 좋겠어요 ㅎㅎ 인원수를 기입하는게 잔여좌석만 나오는 기능인건가.. 그거랑 \n어떤날이던 상관없으니 제일저렴한왕복권을 볼 수 있도록 드롭다운에 추가해주세요 ㅠㅠ \n보고싶은데 그게 안되니 조금 번거롭더라구요,0
662f3b6c34754d6a968729f4,myrealtrip,1,2019-11-08T02:58:55-07:00,오류나서 어플실행도 안된다 항공권 취소도 안되고,0
662f3b6c34754d6a968729f5,myrealtrip,1,2019-11-02T10:00:33-07:00,항공티켓검색에 다구간으로 검색하면 4구간만 검색이 가능하게 되있네요. 전 6개를 경유해야되서 검색하려니 4개의 검색만 되고 다구간 추가도 안되네요. 버그인가요?,0
662f3b6c34754d6a968729f6,myrealtrip,5,2019-10-30T23:21:38-07:00,편리하고  좋은 가격에 감사합니다,0
662f3b6c34754d6a968729f7,myrealtrip,5,2019-10-30T00:03:41-07:00,현지 가이드님과 연결되어 정말 유익한 투어! 세비야에서 좋은 추억 담아갑니다!!,0
662f3b6c34754d6a968729f8,myrealtrip,5,2019-10-28T23:57:55-07:00,"미리 준비하지 않고 온 여행이라서\n걱정했는데,  바로 찾아 비교 가능하고\n가성비도 넘 좋아요",0
662f3b6c34754d6a968729f9,myrealtrip,5,2019-10-28T21:59:18-07:00,자유여행을 선호하지만 일정 내에서 하루이틀 정도 투어를 하고싶거나 입장권 구매대행을 원할때 마이리얼트립을 사용하는데 항상 나를 실망시키지 않음,0
662f3b6c34754d6a968729fa,myrealtrip,5,2019-10-26T16:41:40-07:00,제주도 여행하면서 너무 편하게 타면서 지냈습니다^^\n차량도 k3 2019년식 모델을 이용하였는데 외관과 내부 모두 깨끗해서 좋았습니다^^ \n다만 차량탑승후 네비게이션의 작동만 잘 확인하시고 출발하시면 더욱 완벽한 렌트카 여행을 하실 수 있을거 같아요^^ 빠르게 대여와 반납이 이루어져서 줗았습니다^^\n추천드려요^^,0
662f3b6c34754d6a968729fb,myrealtrip,5,2019-10-26T16:01:44-07:00,마이리얼트립앱을 통해 일본 패스와 호텔을 예약하고 있는데 다양하고 편리한 가성비좋은 패스들과 좋은 호텔 숙소들을 비교하여 예약 할수 있고 거기에다 예약이용후 리워드까지 주니 다시 이용하지 않을 수 없는 여행도우미가 마이리얼트립이 않을까 생각됩니다.\n해외여행엔 마이리얼트립 강추 필추합니다.,8
662f3b6c34754d6a968729fc,myrealtrip,5,2019-10-26T04:11:40-07:00,"우연히 항공권 알아보다가 지인 통해 알게 된 마이리얼트립,\n진정한 나만의 여행을 만들어 여행다니는 데에 딱 맞는 사이트입니다.\n해외여행에 꼭 필요한 동반자, 앞으로도 잘 부탁합니다~",0
662f3b6c34754d6a968729fd,myrealtrip,5,2019-10-25T04:39:55-07:00,할인쿠폰으로 기분도 가볍게 관광할 수 있었어요 . 계속 이용하게 될 겁니다 .,0
662f3b6c34754d6a968729fe,myrealtrip,5,2019-10-25T00:49:35-07:00,장 사용하고 있습니다.,0
662f3b6c34754d6a968729ff,myrealtrip,5,2019-10-24T23:30:05-07:00,좋은정보 좋아요^^,0
662f3b6c34754d6a96872a00,myrealtrip,5,2019-10-20T23:04:21-07:00,여러모로 도우이 많이 되는 유용한 어플잊니다.,0
662f3b6c34754d6a96872a01,myrealtrip,5,2019-10-20T22:53:11-07:00,김세은 가이드님 너무 감사합니다 좋은 여행이였습니다,0
662f3b6c34754d6a96872a02,myrealtrip,5,2019-10-20T18:27:48-07:00,맠,0
662f3b6c34754d6a96872a03,myrealtrip,4,2019-10-17T01:49:44-07:00,너무 좋은여행이였어요\n가는날 마침 폼페이 입장도 무료 였구요\n날은 흐렸지만 비는 왔지만 투어끝나고 와서 다행이였어요~,0
662f3b6c34754d6a96872a04,myrealtrip,5,2019-10-16T18:40:23-07:00,"가이드,숙소 등 카테고리 정리가 잘 되어있어요. 외국에서 결제하고 진행하는 데 문제 없었구요. 앱구동때도 문제 없이 잘 되었어요!",0
662f3b6c34754d6a96872a05,myrealtrip,5,2019-10-15T23:06:41-07:00,유럽여행의 준비를 A-Z까지 한꺼번에 알아볼 수 있는거 같아서 좋아요,0
662f3b6c34754d6a96872a06,myrealtrip,5,2019-10-15T22:49:46-07:00,빠르게 투어 정보를 확인할 수 있어서 유용,0
662f3b6e34754d6a96872a07,skyscanner,1,2024-04-11T18:02:50-07:00,복잡하다\n그리고 사기꾼 키위은 왜 있니?\n본인 40만원 갈취당했다,0
662f3b6e34754d6a96872a08,skyscanner,5,2024-04-08T05:23:14-07:00,이거저거 써봤지만 스카이스캐너만한게 없음,0
662f3b6e34754d6a96872a09,skyscanner,1,2024-03-18T03:00:29-07:00,싼금액엔 결제가 안되요\n2시간 고생하고 결국 못함,0
662f3b6e34754d6a96872a0a,skyscanner,5,2024-03-01T19:13:26-07:00,정보 찾기도 쉽고 저렴하고 +_+ 쵝옹,0
662f3b6e34754d6a96872a0b,skyscanner,3,2024-02-24T23:01:30-07:00,다른건 정상적인데 비행기 가격이 한국원화로 안나오고\n다른나라 언어로 나오는데 이거 못 바꾸나요??,0
662f3b6e34754d6a96872a0c,skyscanner,1,2024-02-04T17:07:21-07:00,유저 정보 수정이 제대로 반영되지 않는 것 같습니다.,0
662f3b6e34754d6a96872a0d,skyscanner,4,2024-02-03T00:57:44-07:00,최고,0
662f3b6e34754d6a96872a0e,skyscanner,5,2024-02-01T01:56:05-07:00,전 미국국적이고 남편과 아이는 한국국적으로 베트남 다낭 티켓을 이곳에서 찾아서 티켓과 호텔을 예약하고 오늘 공항에 갔다가 미국국적은 비자가 필요해서 체크인을 못한다는 이야기를 듣고 취소금액만 백만원을 넘게 지불하고 집으로 가는길입니다. \n\n2주가 넘는 기간동안 베트남 티켓을 검색하고 예약하면서 그 어느 사이트에서도 미국국적은 비자가 필요하다는 정보를 듣지 못했어요. \n\n티켓을 팔았으면 그 이후에 일어날 일들도 같이 팔아야하는거 아닌가요? \n제가 여행사에서 예약했다면 직원은 분명히 저에게 비자에 대한 정보를 주었을꺼에요. \n\n온라인으로 모든게 편리해졌다고 이야기하지만\n여행사에서 조금 더 돈을 내고 예약하는게 이런 10일짜리 여행을 망치진 않았겠죠. \n\n여권정보를 넣는 순간 그 국적사람에게 필요한 비자 정보를 안내해주는 팝업 하나 띄우는게 그리 어려운 일일까 싶으면서 왜 똑똑한 사람들이 모여서 일하는\n곳에서 이렇게 밖에 못하나 싶네요.,0
662f3b6e34754d6a96872a0f,skyscanner,1,2024-01-22T04:07:56-07:00,"최저가 항공권 검색할때 예전에는 예를 들어, 7월 한달 중에서도 첫째주 둘째주 등등 주별로 몇개씩 나왔는데 지금은 제일 싼 항공권 몇개만 나오니까 동일한 시기에 몰려있는 표 밖에 보이지 않아서 최저가 표가 의미가 없음\n그리고 7월, 8월 이렇게 한달 기준으로만 시기를 잡을 수 있게 하지말고 7월 셋째주~8월 둘째주 이런식으로 기간을 정해서 최저가 검색이 가능하면 좋겠음",0
662f3b6e34754d6a96872a10,skyscanner,3,2024-01-21T17:17:44-07:00,"어디든지 검색에 홍콩, 마카오가 중국에 들어가 찾기도 힘들고 탭들이 커져서 이전보다 스크롤을 엄청 더 내려야하네요. 예전에는 스크롤 내리면 다음 달로도 넘어가서 최저가 확인이 가능한데 이제는 달 마다 클릭을 해야해요. 한페이지에 정보가 너무 적게 담겨있어요. 특가 항공권이 달에 10개 미만으로 보여집니다. 4-5일 일정은 특가항공권 검색에 주말, 주말포함연휴, 일주일, 일주일이상에 찾을 수 없어서 불편합니다. 이 경우 이전에는 막대그래프로 봤던거 같은데 그 기능이 안보이네요.",0
662f3b6e34754d6a96872a11,skyscanner,1,2024-01-21T08:46:04-07:00,바뀐 뒤 너무 불편합니나\n바뀌기전으로 돌려놔주세여,0
662f3b6e34754d6a96872a12,skyscanner,2,2024-01-19T00:45:23-07:00,ㅇㅇ,0
662f3b6e34754d6a96872a13,skyscanner,1,2024-01-17T15:54:12-07:00,1. ‘언제든지’ 탭에서 일본이 바로 조회가 안돼서 따로 일본을 검색해야 하는 불편함 2. 최저가랍시고 뜬 항공편 예약하러 들어가면 2~3배 높은 가격으로 바뀜 이건 뭐 장난하자는건지 도통 모르겠네요,0
662f3b6e34754d6a96872a14,skyscanner,1,2024-01-13T15:25:56-07:00,업데이트 전이 더욱 편리했습니다. 언제든지 창에서 직항 버튼이 없어져 매우 불편합니다. 자꾸 최저가만 뜨네요,0
662f3b6e34754d6a96872a15,skyscanner,4,2024-01-04T00:45:09-07:00,편리합니다,0
662f3b6e34754d6a96872a16,skyscanner,4,2023-12-29T03:09:29-07:00,"안녕하세요, 항공권 가격 비교 어플로 가장 많이 애용중입니다. 좋은 앱 덕분에 편리하게 항공권 비교할 수 있어 좋아요! \n그런데 최근에 앱이 업데이트되면서, “언제든지” 서비스에 이상이 있는 것 같습니다.\n프리랜서로 일하면서 특정 날짜를 정해두지 않고 여행지만 정한 다음 ”언제든지“로 설정하여 특가 항공권을 보곤 했는데\n업뎃 전에는 “직항” 으로 설정 후 보기가 가능했다면 현재 ”직항“ 설정 버튼은 볼 수가 없어 경유를 할 경우의 최저가만 보여지다보니 이 서비스가 필요가 없어졌어요.. \n빠른 복구 부탁드리겠습니다. 감사합니다!",0
662f3b6e34754d6a96872a17,skyscanner,1,2023-12-22T23:18:52-07:00,예약하는데 실패라길래 다시 검색했는데 가격 오름 그러고 다시 예매하는데 또 안되길래 검색했는데 또 가격 오름 기분나빠서 여행안함,0
662f3b6e34754d6a96872a18,skyscanner,5,2023-12-22T20:28:02-07:00,시간마다 알려줘서 편해서 좋아요,0
662f3b6e34754d6a96872a19,skyscanner,5,2023-12-17T18:56:44-07:00,베트남갈때 잘썻습니다 실시간 조회는 스카이스캐너!,0
662f3b6e34754d6a96872a1a,skyscanner,3,2023-12-15T00:23:12-07:00,"검색까지 좋음. 예약 페이지 가격 변경도 그럴 수\n있음. 다만, 실제 예약까지 늦음.",0
662f3b6e34754d6a96872a1b,skyscanner,5,2023-12-04T16:18:18-07:00,경제 실속 상품이 많아 좋습니다.,0
662f3b6e34754d6a96872a1c,skyscanner,1,2023-11-21T03:05:53-07:00,구매하러 들어가면 표가 없네요,0
662f3b6e34754d6a96872a1d,skyscanner,3,2023-11-17T21:22:49-07:00,"어디든지 언제든지 검색. 어느 기간에도 있지도 않은 말도 안되는 가격도 많고, 대략적 있을법한 가격에 기간별로 들어가도 오르는건 기본, 간혹은 그마저도 두배이상 오르는것도 생기고. 코비드 기간에는 이용자가 많지않아서 그냥 그런가보다 했지만 언제 제대로 반영되게 수정되나요?? 가격이 제맘대로면 검색하는 의미가 있을까요??",0
662f3b6e34754d6a96872a1e,skyscanner,1,2023-11-17T00:13:14-07:00,사진은 뭐 비밀임? \n제대로 보여지는 사진도 없도 리뷰하나 읽을라면 한나절걸림 \n핸드폰이 안터지는건가했는데 어딜가나 안보임,0
662f3b6e34754d6a96872a1f,skyscanner,5,2023-11-15T19:32:36-07:00,빠르고 정확한검색 금액도 만족이요,0
662f3b6e34754d6a96872a20,skyscanner,4,2023-11-12T03:09:28-07:00,중소도시 항공권이 비싼 곳이 있습니다 좀 더 검색을 원활히 해 주도록 노력해 주세요.,0
662f3b6e34754d6a96872a21,skyscanner,1,2023-11-06T16:05:01-07:00,일정변경할려고 예매취소하고 환불기다리는 사이에 이미 일본 갔다왔다 개새들아..이메일도 일방적인 통보고 어쩌라는겨 시발것들 진짜 장난하나,0
662f3b6e34754d6a96872a22,skyscanner,1,2023-11-02T16:00:57-07:00,아니 선택만 하면 갑자기 10만원 올라버리네,0
662f3b6e34754d6a96872a23,skyscanner,5,2023-10-23T20:41:43-07:00,스카이스캐너가 없으면 각 항공사이트마다 가격비교를 해야되는데 너무 편리함,0
662f3b6e34754d6a96872a24,skyscanner,4,2023-10-22T19:55:11-07:00,최저가부터 최대한 많은 항공권 검색이 되서 편하고 설명이 잘되어 있어 편합니다 간혹 막힌 사이트도 보여서 최저가 검색에 실패하긴 하지만요,0
662f3b6e34754d6a96872a25,skyscanner,5,2023-10-22T19:32:20-07:00,특히 동남아 비행기 및 동남아 국내 비행기 예약 정말 편리함,0
662f3b6e34754d6a96872a26,skyscanner,3,2023-10-14T22:02:34-07:00,호텔은 되네요,0
662f3b6e34754d6a96872a27,skyscanner,1,2023-10-14T03:25:48-07:00,항공사 여행사 다 레전드네요 진짜 ㅋㅋ 수수료가 얼마나 떼이는지 어휴,0
662f3b6e34754d6a96872a28,skyscanner,5,2023-10-01T02:28:35-07:00,앱 스타일도 깔끔하고 효율적인 어플같습니다.,0
662f3b6e34754d6a96872a29,skyscanner,5,2023-09-28T15:48:17-07:00,다른 곳에 비해 조금 저렴한것 같아요,0
662f3b6e34754d6a96872a2a,skyscanner,5,2023-09-21T19:53:18-07:00,항상 잘\n이용하고 있어요~,0
662f3b6e34754d6a96872a2b,skyscanner,1,2023-09-17T20:12:36-07:00,예매불가능한 티켓이 올라와ㅠ잇어요,0
662f3b6e34754d6a96872a2c,skyscanner,3,2023-09-14T10:30:02-07:00,"업데이트 되고 바뀐거 가격 알아보기 너무너무너무너무어무너무너무너무 불편합니다,,,",0
662f3b6e34754d6a96872a2d,skyscanner,5,2023-09-14T04:33:09-07:00,이거 아이폰 으로 하는데 계속 서버 점검 뜨네요,0
662f3b6e34754d6a96872a2e,skyscanner,5,2023-09-11T14:39:41-07:00,어디든지를 선택하는 퍼소나의 상황\n\n1. 시간은 정해져 있으나 어디로 떠나야 할지 정하기 위함\n\n제한된 시간을 활용하는 경우가 있으니 국가를 선택하기 전에 출국 출발시각/입국 도착시간을 필터에 입력할 수 있는 단계가 필요함\n\n2. 시간도 어디로 떠날지도 모르는 경우\n\n현 장치로도 크게 문제는 없으나 여행일정을 3-5일/5일 이상으로 묶어 잡는것 보다 일단위로 쪼개어 더 디테일하게 설정할 수 있게함. 적어도 3일 이하/3-5일/5일 이상정도의 선택지 필요. 3일과 5일의 차이는 크다.\n\n감사합니다.,0
662f3b6e34754d6a96872a2f,skyscanner,5,2023-09-02T03:25:58-07:00,감사할정도로 좋다,0
662f3b6e34754d6a96872a30,skyscanner,5,2023-08-31T18:48:37-07:00,신속 정확하게 전세계 비행노선을 최저가에 예약 할수있다,0
662f3b6e34754d6a96872a31,skyscanner,4,2023-08-22T00:24:08-07:00,비행기 이용할때마다 여기서 항공권 구매해요\n편리하고 좋은데 원하는 시간대가 떠서 들어가보면 이미 매진이고 다시 들어가도 그 시간대가 사라지지 않고 보이고ㅠ매진이 된거는 빨리 새로고침이 되었으면 좋겠어요!!,0
662f3b6e34754d6a96872a32,skyscanner,1,2023-08-21T07:47:19-07:00,찜 누르려는데 무언가 잘못됐다면서 나갔다 다시 접속해도 안되고 왜이러냐 답답해 미쳐버려 가격변동 알람도 안되고 버퍼링 접속시간 엄청 길고,0
662f3b6e34754d6a96872a33,skyscanner,1,2023-08-19T00:28:13-07:00,친구랑 여행갈려고 동시에 같은 날짜 같은 항공권 검색했는데 저는 48만원 친구는 41만원이 뜨네요. 자주 검색하면 가격 더 올리시는건가요??,0
662f3b6e34754d6a96872a34,skyscanner,3,2023-08-16T03:29:31-07:00,다 좋다 다좋은데 결제통화 바꾸는게 없다. 아니 있었는는거 같은데 안보인다 많이 불편타,0
662f3b6e34754d6a96872a35,skyscanner,5,2023-08-05T18:21:37-07:00,사용자 편의성이 좋네요,0
662f3b6e34754d6a96872a36,skyscanner,5,2023-08-02T00:24:12-07:00,그간 스카이스캐너 이용시 항공권만 사용했었는데 \n이번에 미국 출장중에 급하게 렌트할일이 있었는데 \n다른 큰 렌트카 싸이트에서는 없는 여기에만 나오는 가성비 좋은 차량이 있어서 잘 이용했습니다. 앞으로도 항공뿐 아니라 렌트도 숙박도 애용하겠습니다,0
662f3b6e34754d6a96872a37,skyscanner,1,2023-07-28T23:03:28-07:00,가르쳐 주세요,0
662f3b6e34754d6a96872a38,skyscanner,1,2023-07-24T19:12:37-07:00,제가 콜센타에다가 전화를 몇번 들였는대도 허위 항공권이 ㅡㅡ\n피크타임 항공권은 자주 들어가서 확인하는데 진행하면 없다고 나와요 제박 허위 매물로 고객들 맘 상하게 하지 마세요,0
662f3b6f34754d6a96872a39,skyscanner,4,2023-07-06T21:11:45-07:00,여행갈때 제일 먼저 이용합니다\n아주 오래전부터,0
662f3b6f34754d6a96872a3a,skyscanner,1,2023-07-06T19:07:37-07:00,가격비교는 좋는데 여행사와의 소통이 너무 어려움 .. \n예약 변경이나 취소 거의 못한다고 보면됨..\n\n앱 삭제합니다 \n\n가급적이면 항공사 통해서 예매하시길,0
662f3b6f34754d6a96872a3b,skyscanner,1,2023-06-30T03:47:35-07:00,Can't remove xxxking transfer option. It re-appears again and again.,0
662f3b6f34754d6a96872a3c,skyscanner,5,2023-06-27T15:55:33-07:00,죠아,0
662f3b6f34754d6a96872a3d,skyscanner,1,2023-06-18T20:42:19-07:00,무한 전체검색 중입니다~~,0
662f3b6f34754d6a96872a3e,skyscanner,5,2023-06-01T20:20:36-07:00,굿입니다,0
662f3b6f34754d6a96872a3f,skyscanner,2,2023-05-31T13:30:39-07:00,서비스는 다 좋은데 일본전범기 욱일기같아서 볼때마다  불쾟사네요,0
662f3b6f34754d6a96872a40,skyscanner,1,2023-05-18T06:21:37-07:00,금액도 다르고 마음대로임..,0
662f3b6f34754d6a96872a41,skyscanner,1,2023-05-11T22:50:29-07:00,여행 날짜 언제든지로 설정해서 검색하면 나라별로 ~부터라고 뜨는데 막상 들어가서 대 찾아보면 그 가격대가 안나옵니다,0
