reply,reply_clean_okt,positive,topic
"☆★☆ 핵심 정보 ☆★☆\n 울릉도 배편?  [ 대저페리 ]\n     - 엘도라도 익스프레스호 : 울릉도로 가는 가장 빠르고 편한 초쾌속 여객선 (01:02)\n     - 썬라이즈호 : 울릉도에서 독도 여행시 가장 편한 초쾌속 여객선 (05:43)\n     - 홈페이지 : \n     - 인스타그램 : \n 울릉도 숙소?  [ 스테이너와 – 감성 넘치는 예쁜 숙소 ] ()\n     - 위치 : 경북 울릉군 북면 평리1길 124\n     - 연락처 : 010-9829-9831\n     - 인스타그램 : \n     - 예약 : 네이버에서 ’스테이너와’ 검색\n 울릉도에서 즐기는 액티비티?  [ 캄인블루 – 프리다이빙 ] ()\n     - 위치 : 경북 울릉군 북면 천부3길 337 캄인블루 프리다이빙센터\n     - 연락처 : 010-4953-0346\n     - 인스타그램 : \n\n\n☆★☆ 필수 여행지 ☆★☆\n 행남해안산책로 ()\n     - 입장료 : 무료\n     - 태풍 피해 복구로 인해 일부 구간 통행 제한 있음\n 독도전망대 / 케이블카 ()\n     - 운영시간 : 하절기 8시~19시 / 동절기 8시~18시\n     - 요금 : 어른 7500원 / 청소년 5500원 / 어린이,경로 3500원\n 관음도 ()\n     - 운영시간 : 하절기 8시~18시 / 동절기 9시~18시\n     - 요금 : 어른 4000원 / 청소년 3000원 / 어린이,경로 2000원\n      - 관음쌍굴 : 울릉도 해상 3대 비경\n 삼선암 ()\n      - 울릉도 해상 3대 비경 중 으뜸\n 대풍감 / 태하향목모노레일 ()\n      - 대한민국 10대 비경의 하나\n     - 모노레일 타고 ‘향목전망대’까지 6분 소요 \n     - 좁은 숲 길을 따라 대풍감 제1전망대(향목전망대에서 250m), 제2전망대(향목전망대에서 420m)까지 추가로 가볼 수 있음\n     - 운영시간 : 9시~18시\n     - 요금 : 어른 4000원 / 청소년 3000원 / 어린이,경로 2000원\n 태하해안산책로 ()\n      - 태하향목모노레일 타는곳 근처에서 출발\n      - 해풍에 의해 특이하게 침식된 지형이 발달하여 수려한 해안 절경을 자랑하는 곳\n\n\n☆★☆ 기타 추가하면 좋은 여행지 ☆★☆\n 송곳산 ()\n      - 수직 암벽의 봉우리가 송곳을 세워놓은 것 같다고 하여 명명된 452m의 바위산\n      - 산 아래 북쪽 해안에는 추산몽돌해수욕장과 추산항이 있고, 해안에서 북서쪽으로 1km 떨어진 바다에는 코끼리바위가 있다\n 카페울라 ()\n      - 송곳산을 배경으로, 송곳산에 산다는 고릴라 ‘울라’가 있는 울릉도 카페\n      - 인생샷 가능한 울릉도 사진 명소\n 코끼리바위 ()\n      - 울릉도 해상 3대 비경의 하나\n      - 코끼리가 코를 물에 담그고 물을 마시는 것처럼 보임\n      - 주상절리가 수직에 가깝게 발달되어 있음\n 천부해중전망대 ()\n      - 수중 6m 자연 아쿠아리움 / 신비로운 울릉도 바닷속을 눈으로 직접 보며 체험하는 곳\n      - 운영시간 : 9시~18시\n      - 요금 : 어른 4000원 / 청소년 3000원 / 어린이,경로 2000원\n 나리분지 ()\n      - 울릉도에서 유일하게 평지를 이룬 곳\n      - 울릉도의 독특한 가옥구조인 너와투막집과 억새투막집을 돌아볼 수 있음\n 통구미항 거북바위 ()\n      - 울릉군 서면 남양리의 통구미항에는 새끼거북을 업고 걸어가는 모양의 ‘거북바위’가 있다.\n      - 거북바위 맞은편에는 ‘코뿔소’처럼 보이는 거대한 바위가 있는데, 향나무 자생지로 천연기념물 제48호로 지정된 곳입니다.\n 수층교 ()\n      - 독특한 모습의 도로와 해안 풍광이 어우러지는 곳\n      - 급경사 언덕의 고저차를 극복하기 위해 독특한 모습으로 만들어졌다.\n 노인봉 ()\n      - 울릉군 북면 현포리에 우뚝 솟은 높이 199m의 암벽 봉우리\n      - 암벽에 가로로 굵은 결이 있는데, 노인의 주름살처럼 보인다 하여 ‘노인봉’이 되었다.",핵심 정보 릉도 배편 페리 엘도라도 익스 프레 스호 릉도 가장 빠르다 편 초 쾌속 여객선 라즈 호 릉도 독도 행시 가장 편 초 쾌속 여객선 홈페지 스타그램 릉도 숙소 스테 너 감성 넘치다 예쁘다 숙소 위치 경북 릉군 북면 평리 길 연락처 스타그램 예약 네버 스테 너 검색 릉도 액 티비 티 캄 블루 프리다빙 위치 경북 릉군 북면 천부 길 캄 블루 프리다빙 센터 연락처 스타그램 필수 여행지 행 남해안 산책로 입장료 무료 태풍 피해 복구  일부 구간 통행 한  독도 망 케블카 운영 시간 하절 기 절기 금 어른 청소년 어린 경로 관음도 운영 시간 하절 기 절기 금 어른 청소년 어린 경로 관음 쌍굴 릉도 해상 비경 삼선 암 릉도 해상 비경 중 으뜸 풍 감 태 하향 목 모노레일 한민국 비경 하나 모노레일 타고 향목 망 소 좁다 숲 길 풍 감  망 향목 망  망 향목 망 추가 수  운영 시간 금 어른 청소년 어린 경로 태 해안 산책로 태 하향 목 모노레일  근처 출발 해풍 의 특 침식 지형 발달 수려 해안 절경 자랑  기타 추가 좋다 여행지 송 산 수직 암벽 봉우리 송 것 같다 명명 의 바위 산 산 래 북쪽 해안 추산 몽돌 해수욕장 추산 항  해안 북서쪽 바다 코끼리 바위  카페  송 산 배경 송 산 산다 고릴라   릉도 카페 생 샷 가능 릉도 사진 명소 코끼리 바위 릉도 해상 비경 하나 코끼리 코 물 물 것 보임 주상절리 수직 가깝다 발달  천부 해중 망 수중 자연 쿠리움 신비롭다 릉도 바 속 눈 직접 체험  운영 시간 금 어른 청소년 어린 경로 나리분지 릉도 일 평지  릉도 독특 가옥 구조 너 투막집 투막집 수  통구미항 거북 바위 릉군 서면 남양 리 통구미항 새끼 거북 모양 거북 바위  거북 바위 맞은편 코뿔소 처럼 거 바위  향나무 자생 지로 천연기념물  호로 지정   층교 독특 모습 도로 해안 광  급경사 언덕 차 극복 위해 독특 모습 노 봉 릉군 북면 포리 우뚝 높 의 암벽 봉우리 암벽 가로 굵다 결  노 주름살 노 봉 ,1.0,
옥천ㅡ금강수변침수공원ㆍ수생식물 학습원  (꼭예약)  화인 살림욕장\n상춘정 (밤 은하수 인기 사진작가  인기 코스)   부소담악(배타고 호수돌면  최고),옥천 금강 변 침수 공원 수생 식물 학습원 꼭 예약 화 살림 욕 상춘 정 밤 은하수 기 사진작가 기 코스 부 소담 악 배타 호수 최고,1.0,
주말에 배편예약해서 가야되나요?\n차를싣고가도 되나요?,주말 배편 예약 가야 차,1.0,
"통영! 안가본지 꽤 됐는데 이렇게 보니 날잡고 가고 싶네요ㅠㅠ 통영에도 좋은 숙소가 많은 걸로 알고 있는데 당장 예약 뽐뿌 오는 영상이에요,, 전망대는 물론이고 고요한 분위기의 미래사도 아름답네요. 한국은 미세먼지로 고통받고 있다는데 편백나무 숲이라면 숨을 맘껏 내쉬고 들이마실 수 있을 것 같아요 :) 해물 뚝배기 실화인가요...? 밥 한그릇 뚝딱하겠어요ㅠㅠㅠ 알찬 영상 잘 봤어요, 통영에 가게 될 때 꼭 참고할게요 감사합니다",통영 안 꽤 날 잡고 통영 좋다 숙소 많다 걸 알  당장 예약 뽐뿌 영상 망 고한 분위기 미래 사도 름답다 한국 미세먼지 고통  편백나무 숲  라면 숨 맘껏 수  것 같다 해물 뚝배기 실화 밥 한 그릇 뚝딱 알차다 영상 통영 가게  꼭 참고,1.0,
이 영상을 6월에 봤어야 했는데... ㅠㅠ 지금은 코로나 때문에 예약불가 ㅠㅠ, 영상 지금 코로나 문 예약 불가,1.0,
"화성 공룡알 화석지는 들어는 봤지만 공룡에 관심없어서 갈 생각을 안 했는데 영상 보니 무조건 가야겠네요^^ 지난주에 우연히 화성시티투어(해설사 동반)를 알게되어 이번주 일요일에 국화도 가는거 예약해놔서 지금 마구 설레는 중인데요. 그 투어의 다른 코스에 공룡알 화석지도 있었어요. 다음엔 여기로 예약 찜! 이 영상 하나로 바로 구독,좋아요,알림설정 완료했어요\n️",화성 공룡 알 화석 공룡 관심 없다 생각 안 영상 무조건 지난주 화성 시티투어 해설 사 동반 를 알  주 일일 국화도 예약 지금 마구 설레다 중  그 투어 다른 코스 공룡 알 화석 지도  다음 여기 예약 찜  영상 하나로 바로 구독 좋다 알림 설정 완료,1.0,
